{"base_ref":"HEAD~1","config":{"binary_file_policy":"fail","context_radius_lines":1,"fail_on_slice_truncation":true,"max_lines_per_slice":120,"max_slices_per_target":8,"max_total_lines":1200,"merge_gap_lines":1},"head_ref":"HEAD","kind":"context_slices","provenance":{"algorithm":"context_slice_extraction_v1","deterministic":true,"head_version_content":true},"repo_path":"<repo>","run_id":"run-golden","schema_version":"v1","slices":[{"changed_line_count":1,"content":"line04\nline05_mod\nline06","end_line":6,"file_path":"a.py","origin":{"base_ref":"HEAD~1","changed_ranges":[[5,5]],"head_ref":"HEAD","source":"git_diff_head_version"},"slice_id":"a.py:4:6","start_line":4,"total_line_count":3}],"summary":{"slice_count":1,"target_count":1,"total_line_count":3}}
